775,1.0,1.0,1.0,1.0,1.0,1.0,1.0,1.0,1.0,1,89.792,1.0,1,"Excelente profesor, con un gran conocimiento dentro de la materia. Busca la manera de transmitir  de una manera sencilla a sus alumnos los temas del curso. ",1.0,"['excelente', 'profesor', 'gran', 'conocimiento', 'dentro', 'materia', 'buscar', 'manera', 'transmitir', 'manera', 'sencillo', 'alumno', 'tema', 'curso']"
776,0.0,0.0,0.0,0.0,0.0,0.0,0.0,0.0,0.0,1,84.933,1.0,2,NO LO RECOMIENDO No sabe dar clase. Es injusto al calificar,0.0,"['no', 'recomer', 'no', 'saber', 'dar', 'clase', 'injusto', 'calificar']"
777,0.0,1.0,0.0,0.0,0.0,0.0,0.0,0.0,0.0,1,97.0,1.0,1,Dominio total de los temas y explicaciones claras ,0.0,"['dominio', 'total', 'tema', 'explicación', 'claro']"
778,1.0,1.0,1.0,1.0,1.0,1.0,0.0,1.0,1.0,1,88.211,1.0,1,"Tiene mucha experiencia, se preocupa por que aprendas los temas y explica las veces que sea necesario ",1.0,"['mucho', 'experiencia', 'preocupar', 'aprender', 'tema', 'explicar', 'vez', 'necesario']"
779,1.0,1.0,1.0,1.0,1.0,1.0,1.0,1.0,1.0,0,76.241,1.0,1,"Víctor es un profesor excepcional, ya que durante todo el curso nos ha mantenido ocupados a la hora de calificar te pone notas para que a la hora del examen lo comprendas mejor. Es un profesor que me reta todos los días a sacar lo mejor de mí. Cumple con todo el programa académico e incluso en las asesorías aprendes más allá de lo que ves en clase. Extraordinaria clase. Felicidades. ",1.0,"['víctor', 'profesor', 'excepcional', 'curso', 'mantener', 'ocupado', 'hora', 'calificar', 'poner', 'nota', 'hora', 'examen', 'comprender', 'mejor', 'profesor', 'retar', 'día', 'sacar', 'mejor', 'yo', 'cumplir', 'programa', 'académico', 'incluso', 'asesoría', 'aprender', 'allá', 'ver', 'clase', 'extraordinario', 'clase', 'felicidad']"
780,0.0,0.0,1.0,1.0,0.0,0.0,0.0,0.0,1.0,0,89.0,1.0,1,Muchísismas gracias por todas la asesorías. Excelenete clase ,0.0,"['muchísisma', 'gracias', 'todo', 'asesoría', 'excelenete', 'clase']"
781,1.0,1.0,1.0,1.0,1.0,1.0,1.0,1.0,1.0,1,88.166,1.0,1,excelente maestro siempre dispuesto a enseñarte y se esfuerza para que aprendas ,1.0,"['excelente', 'maestro', 'siempre', 'dispuesto', 'enseñar', 'esforzar', 'aprender']"
782,1.0,1.0,1.0,1.0,1.0,1.0,1.0,1.0,1.0,1,88.23,1.0,2,Excelente Ninguna razón,1.0,"['excelente', 'ninguno', 'razón']"
783,1.0,1.0,1.0,1.0,1.0,1.0,1.0,0.0,1.0,1,87.317,1.0,2,"Excelente maestro, se interesa mucho en el aprendizaje de sus alumnos. Enseña muy bien la materia. Si lo recomendaría, pero si deja tarea cada clase.",1.0,"['excelente', 'maestro', 'interesar', 'aprendizaje', 'alumno', 'enseñar', 'bien', 'materia', 'si', 'recomendar', 'si', 'dejar', 'tarea', 'cada', 'clase']"
784,0.0,1.0,1.0,1.0,1.0,0.0,1.0,0.0,1.0,1,91.115,1.0,1,"Un poco rápido el ritmo de la clase, con mucha información por sesión y se llega a hacer tedioso ",0.0,"['rápido', 'ritmo', 'clase', 'mucho', 'información', 'sesión', 'llegar', 'hacer', 'tedioso']"
785,1.0,1.0,1.0,0.0,1.0,1.0,1.0,1.0,1.0,0,77.285,1.0,2,no hay elementos no,1.0,"['no', 'elemento', 'no']"
786,1.0,1.0,1.0,0.0,1.0,1.0,1.0,1.0,1.0,0,90.333,1.0,1,No he tomado clases con el ,1.0,"['no', 'tomado', 'clase']"
787,1.0,1.0,0.0,1.0,0.0,1.0,0.0,0.0,0.0,0,96.153,1.0,2,"Es un maestro lleno de sabiduría dispuesto a compartirla con todos sus alumnos, es artista y nos motiva a serlo también, es creativo, y hace que veamos las cosas con otro ojo. Creo que en general la clase mejoraría mucho si se tomaras en cuenta aspectos respecto al tiempo... Por ejemplo, terminar la clase a tiempo, que las presentaciones de proyectos de los alumnos no se alarguen para no atrasar el resto de las actividades, y también subir calificaciones a tiempo. Son detalles pequeños pero harían una gran diferencia. Le darían la importancia adecuada a cada proyecto ya que cada uno tiene un espacio qué dedicarle.",0.0,"['maestro', 'lleno', 'sabiduría', 'dispuesto', 'compartir', 'el', 'alumno', 'artista', 'motivar', 'ser', 'él', 'también', 'creativo', 'hacer', 'ver', 'cosa', 'ojo', 'creer', 'general', 'clase', 'mejorar', 'si', 'tomar', 'cuenta', 'aspecto', 'respecto', 'tiempo', 'ejemplo', 'terminar', 'clase', 'tiempo', 'presentación', 'proyecto', 'alumno', 'no', 'alargar', 'no', 'atrasar', 'resto', 'actividad', 'subir', 'calificación', 'tiempo', 'detalle', 'pequeño', 'hacer', 'gran', 'diferencia', 'dar', 'importancia', 'adecuado', 'cada', 'proyecto', 'cada', 'espacio', 'dedicar', 'él']"
788,0.0,0.0,0.0,0.0,0.0,0.0,0.0,0.0,0.0,0,86.352,1.0,0, No hacemos mucho y no califica justo.,0.0,"['no', 'hacer', 'no', 'calificar', 'justo']"
789,1.0,1.0,0.0,1.0,0.0,0.0,1.0,1.0,1.0,0,82.076,1.0,2,considero que es buena influencia y nos quiere culturizar puede que se desvie mucho del tema,1.0,"['considerar', 'buen', 'influencia', 'querer', 'culturizar', 'poder', 'desviar', 'tema']"
790,1.0,1.0,0.0,1.0,0.0,1.0,0.0,0.0,1.0,0,84.086,1.0,1,muy interesantes sus platicas ,1.0,"['interesante', 'platica']"
791,0.0,0.0,0.0,0.0,0.0,0.0,0.0,0.0,0.0,0,72.227,1.0,0," Realmente no nos enseñó nada de diseño, se la pasaba hablando de su poesía y nos encargaba trabajos de eso, luego nos encarga un trabajo muy difícil y uno no sabe como hacerlo porque no nos enseñó nada. Además pierde mucho tiempo.",0.0,"['realmente', 'no', 'enseñar', 'diseño', 'pasar', 'hablar', 'poesía', 'encargar', 'trabajo', 'ese', 'luego', 'encargar', 'trabajo', 'difícil', 'no', 'saber', 'hacer', 'él', 'no', 'enseñar', 'nada', 'además', 'perder', 'tiempo']"
792,1.0,1.0,0.0,1.0,0.0,0.0,0.0,1.0,1.0,1,92.692,1.0,2,Son aburridas sus clases hasta cierto punto Porque hasta cierto punto son muy aburridas sus clases,0.0,"['aburrido', 'clase', 'cierto', 'punto', 'cierto', 'punto', 'aburrido', 'clase']"
793,0.0,1.0,0.0,0.0,0.0,0.0,0.0,0.0,0.0,1,79.222,1.0,2,Arte por la intensa impaciencia que tiene a la tecnología,0.0,"['arte', 'intenso', 'impaciencia', 'tecnología']"
794,1.0,1.0,1.0,1.0,1.0,0.0,1.0,0.0,0.0,1,87.083,1.0,1,"Una joya de profesor en un sistema frío y gris, un maestro que te hace querer ir a la clase y participar, una gran experiencia que jamás olvidare ",1.0,"['joya', 'profesor', 'sistema', 'frío', 'gris', 'maestro', 'hacer', 'querer', 'ir', 'clase', 'participar', 'gran', 'experiencia', 'jamás', 'olvidar']"
795,1.0,1.0,1.0,1.0,1.0,1.0,1.0,0.0,1.0,1,78.762,1.0,1,"Excelente profesor, un curso muy útil tanto a nivel personal como profesional. ",1.0,"['excelente', 'profesor', 'curso', 'útil', 'nivel', 'personal', 'profesional']"
796,1.0,1.0,1.0,1.0,1.0,1.0,1.0,1.0,1.0,0,94.72,1.0,1,El profesor es muy apasionado en su explicación de la clase y está comprometido con sus alumnos. Te conoce de nombre y da retroalimentación valiosa. ,1.0,"['profesor', 'apasionado', 'explicación', 'clase', 'comprometido', 'alumno', 'conocer', 'nombre', 'dar', 'retroalimentación', 'valioso']"
797,1.0,1.0,1.0,1.0,1.0,1.0,1.0,1.0,1.0,0,79.363,1.0,1,Buen maestro ,1.0,"['buen', 'maestro']"
798,1.0,1.0,1.0,1.0,1.0,1.0,1.0,1.0,1.0,0,91.303,1.0,1,"Sus clases son demasiado útiles para la vida personal y profesional, siempre aprendes algo nuevo y refuerzas los conocimientos previos de la carrera. Un excelente profesor y modelo a seguir. ",1.0,"['clase', 'demasiado', 'útil', 'vida', 'personal', 'profesional', 'siempre', 'aprender', 'nuevo', 'refuerzo', 'conocimiento', 'previo', 'carrera', 'excelente', 'profesor', 'modelo', 'seguir']"
799,1.0,1.0,1.0,1.0,1.0,1.0,1.0,1.0,1.0,0,86.438,1.0,2,enseña muy bien y aprendes mucho si lo recomiendo,1.0,"['enseñar', 'bien', 'aprender', 'si', 'recomer']"
800,1.0,1.0,1.0,1.0,1.0,1.0,1.0,1.0,1.0,1,86.315,1.0,2,Porque simplemente es una eminencia dentro de su materia y es una persona de alta calidad. Sin comentario.,1.0,"['simplemente', 'eminenciar', 'dentro', 'materia', 'persona', 'alto', 'calidad', 'comentario']"
801,1.0,1.0,1.0,1.0,1.0,1.0,1.0,1.0,1.0,0,81.338,1.0,1,Sabe un buen y es muy bueno enseñando ,1.0,"['saber', 'buen', 'buen', 'enseñar']"
802,1.0,1.0,0.0,1.0,1.0,1.0,1.0,1.0,1.0,0,77.694,1.0,2,"es una inspiración realmente, tenerlo coo profe y aprender de él en persona es un honor; sabe MUCHO de su materia y de TODA la contabilidad, aparte de aconsejarnos cara a cara para prepararnos al salir al mundo laboral y soñar en grande. me hace pensar que todo es posible. lo recomiendo 100%",1.0,"['inspiración', 'realmente', 'tener', 'él', 'coo', 'profe', 'aprender', 'persona', 'honor', 'saber', 'materia', 'todo', 'contabilidad', 'aparte', 'aconsejar', 'yo', 'cara', 'cara', 'preparar', 'yo', 'salir', 'mundo', 'laboral', 'soñar', 'grande', 'hacer', 'pensar', 'posible', 'recomer', '100']"
803,1.0,1.0,1.0,1.0,1.0,1.0,1.0,1.0,1.0,0,87.653,1.0,1,AY! ES EL MEJOR PROFESOR QUE HE TENIDO <3 ,1.0,"['ay', 'mejor', 'profesor', '3']"
804,1.0,1.0,1.0,1.0,1.0,1.0,1.0,1.0,1.0,0,85.357,1.0,1,Excelente ,1.0,['excelente']
805,1.0,1.0,1.0,1.0,1.0,1.0,1.0,1.0,1.0,0,84.415,1.0,1,Profesor muy preparado ,1.0,"['profesor', 'preparado']"
806,1.0,1.0,1.0,1.0,1.0,0.0,1.0,1.0,1.0,0,81.666,1.0,1,Porque explica temas relevantes y siempre esta actualizado además de explicar muy bien. ,1.0,"['explicar', 'tema', 'relevante', 'siempre', 'actualizado', 'además', 'explicar', 'bien']"
807,1.0,1.0,0.0,1.0,1.0,1.0,1.0,1.0,1.0,1,79.75,1.0,2,"Porque sabe mucho, es una persona con muchísima experiencia, hace su clase muy atractiva, es una gran persona y motiva a los estudiantes. Si, lo recomendaria",1.0,"['saber', 'mucho', 'persona', 'muchísimo', 'experiencia', 'hacer', 'clase', 'atractivo', 'gran', 'persona', 'motivar', 'estudiante', 'si', 'recomendar']"
808,1.0,1.0,1.0,1.0,1.0,1.0,1.0,1.0,1.0,1,81.114,1.0,1,Por su experiencia ,1.0,['experiencia']
809,1.0,1.0,1.0,1.0,1.0,1.0,1.0,1.0,1.0,0,86.23,1.0,1,"Excelente profesor, explica increíble, te abre las puertas a conocer a gente exitosa. De los mejores profesores. ",1.0,"['excelente', 'profesor', 'explicar', 'increíble', 'abrir', 'puerta', 'conocer', 'gente', 'exitoso', 'mejor', 'profesor']"
810,1.0,1.0,1.0,1.0,1.0,1.0,1.0,1.0,1.0,1,90.47,1.0,2,Sin comentarios Sin comentarios,1.0,"['comentario', 'comentario']"
811,1.0,1.0,0.0,0.0,1.0,0.0,0.0,1.0,1.0,1,92.703,1.0,1,"Muy buen maestro, en realidad quiere que aprendamos aunque lo que no lo recomiendo es porque pone su materia por encima de las demás, es demasido exagerado al calificar los examenes, el grosor de la linea en un examen el lo veia igual entonces me quito puntos y en realidad use diferentes lapiceros con diferentes grosores de puntilla.... ",0.0,"['buen', 'maestro', 'realidad', 'querer', 'aprender', 'aunque', 'no', 'recomer', 'poner', 'materia', 'encima', 'demás', 'demasido', 'exagerado', 'calificar', 'examen', 'grosor', 'linea', 'examen', 'ver', 'igual', 'entonces', 'quito', 'punto', 'realidad', 'usar', 'diferente', 'lapicero', 'diferente', 'grosor', 'puntilla']"
812,1.0,1.0,1.0,0.0,0.0,1.0,1.0,0.0,1.0,0,94.814,1.0,2,"Domina el tema, sabe lo que aplica a la industria y las tendencias de estos temas, es muy accesible con asesorías y paciente para explicar. Nos atrasamos un poco con el contenido de clase en comparación con el laboratorio y se dificultó el examen de medio término de éste.",1.0,"['dominar', 'tema', 'saber', 'aplicar', 'industria', 'tendencia', 'tema', 'accesible', 'asesoría', 'paciente', 'explicar', 'atrasar', 'contenido', 'clase', 'comparación', 'laboratorio', 'dificultar', 'examen', 'medio', 'término', 'este']"
813,1.0,1.0,1.0,1.0,1.0,1.0,1.0,1.0,1.0,1,90.962,1.0,1,"Sabe y domina su clase, además de que tiene muy presentes los estandares que se ocupan en las empresas. ",1.0,"['saber', 'dominar', 'clase', 'además', 'presente', 'estandar', 'ocupar', 'empresa']"
814,1.0,1.0,1.0,1.0,1.0,1.0,1.0,1.0,1.0,1,78.594,1.0,1,Te da muchas ejercicios que te ayudan a contestar el examen sin problemas ,1.0,"['dar', 'mucho', 'ejercicio', 'ayudar', 'contestar', 'examen', 'problema']"
815,1.0,1.0,1.0,1.0,1.0,1.0,1.0,1.0,0.0,0,81.742,1.0,2,Buena practica y ejercicios. Todo detallado Si recomiendo,1.0,"['buen', 'practicar', 'ejercicio', 'detallado', 'si', 'recomer']"
816,0.0,0.0,0.0,1.0,0.0,0.0,1.0,1.0,1.0,1,90.347,1.0,1,"Buen maestro, muy dedicado a su trabajo ",0.0,"['buen', 'maestro', 'dedicado', 'trabajo']"
817,1.0,1.0,1.0,1.0,1.0,1.0,1.0,1.0,1.0,1,79.428,1.0,1,"excelente profesor, explica muy bien y sabe mucho de los temas que imparte ",1.0,"['excelente', 'profesor', 'explicar', 'bien', 'saber', 'tema', 'impartir']"
818,0.0,1.0,0.0,0.0,0.0,0.0,0.0,0.0,1.0,0,82.655,1.0,2,"Da explicaciones claras Sus criterios de calificar son dudosos, es decir a un compañero le bajaba 3 puntos por un error y a mi 5 por el mismo error, o vice versa.",0.0,"['dar', 'explicación', 'claro', 'criterio', 'calificar', 'dudoso', 'decir', 'compañero', 'bajar', '3', 'punto', 'error', '5', 'mismo', 'error', 'vice', 'versa']"
819,1.0,1.0,1.0,1.0,1.0,1.0,1.0,1.0,1.0,0,81.0,1.0,1,muy buen maestro es bien lindo ,1.0,"['buen', 'maestro', 'bien', 'lindo']"
820,0.0,1.0,0.0,0.0,0.0,0.0,0.0,0.0,0.0,1,86.851,1.0,0, Su forma de evaluar perjudica a los alumnos y muestra una actitud un poco desesperada cuando los alumnos le hacen ciertas preguntas.,0.0,"['forma', 'evaluar', 'perjudicar', 'alumno', 'mostrar', 'actitud', 'desesperado', 'alumno', 'hacer', 'cierto', 'pregunta']"
821,1.0,1.0,1.0,1.0,1.0,1.0,1.0,1.0,1.0,1,94.851,1.0,1,"Uno de los profesores con más experiencia que he tenido en el tec, los consejos y tips que te da de la clase y la industria son invaluables. ",1.0,"['profesor', 'experiencia', 'tec', 'consejo', 'tip', 'dar', 'clase', 'industria', 'invaluable']"
822,1.0,1.0,1.0,0.0,0.0,0.0,0.0,0.0,1.0,1,93.444,1.0,1,"Explicaciones detalladas, y muestra experiencia y conocimiento de la clase ",1.0,"['explicación', 'detallado', 'mostrar', 'experiencia', 'conocimiento', 'clase']"
823,0.0,1.0,0.0,0.0,0.0,0.0,0.0,0.0,0.0,1,94.0,1.0,0, Es muy estricto con algunos estándares del dibujo,0.0,"['estricto', 'estándar', 'dibujo']"
824,1.0,1.0,0.0,1.0,0.0,1.0,1.0,1.0,0.0,1,82.972,1.0,2,Te enseña lo que en realidad vas a usar Si lo recomiendo,1.0,"['enseñar', 'realidad', 'ir', 'usar', 'si', 'recomer']"
825,1.0,1.0,1.0,1.0,0.0,1.0,1.0,1.0,1.0,1,81.3,1.0,1,"Es una clase muy técnica, el profesor es estricto pero accesible. ",1.0,"['clase', 'técnico', 'profesor', 'estricto', 'accesible']"
826,1.0,1.0,1.0,0.0,1.0,1.0,1.0,1.0,1.0,1,82.541,1.0,2,Buen profesor Sin comentarios,1.0,"['buen', 'profesor', 'comentario']"
827,1.0,1.0,0.0,1.0,0.0,1.0,0.0,0.0,0.0,1,76.434,1.0,2,Muy paciente y muy instruido en su área Tiene una ligera tendencia a tratar diferente a los alumnos a quienes el cree que no se interesan en la clase,0.0,"['paciente', 'instruido', 'área', 'ligero', 'tendencia', 'tratar', 'diferente', 'alumno', 'creer', 'no', 'interesar', 'clase']"
828,1.0,1.0,1.0,1.0,1.0,1.0,1.0,1.0,1.0,1,84.062,1.0,1,Con disposición a ayudar ,1.0,"['disposición', 'ayudar']"
829,1.0,1.0,1.0,1.0,1.0,1.0,1.0,1.0,1.0,0,80.868,1.0,1,Es un buen maestro y accecible cuando se tiene alguna duda ,1.0,"['buen', 'maestro', 'accecible', 'alguno', 'duda']"
830,0.0,1.0,1.0,1.0,0.0,0.0,1.0,0.0,1.0,1,93.406,1.0,2,"Conoce mucho acerca de la clase y tiene bastante experiencia en ella. Deja tareas para entender mejor todo y tiene asesorías si es que algo no se entendió. Si a quien se lo voy a recomendar es flojo y no quiere batallar, no lo recomendaría",0.0,"['conocer', 'acerca', 'clase', 'bastante', 'experiencia', 'él', 'dejar', 'tarea', 'entender', 'mejor', 'asesoría', 'si', 'no', 'entender', 'si', 'ir', 'recomendar', 'flojo', 'no', 'querer', 'batallar', 'no', 'recomendar']"
831,1.0,1.0,1.0,0.0,1.0,1.0,1.0,1.0,1.0,1,88.842,1.0,2,Buen maestro Si lo recomiendo,1.0,"['buen', 'maestro', 'si', 'recomer']"
832,1.0,1.0,1.0,0.0,0.0,1.0,1.0,1.0,1.0,0,93.724,1.0,1,"Muy buen maestro se ve que le gusta mucho el temario de sus clases, su forma de enseñar es mediante el trabajo en equipos y la organización de un proyecto en el cual todos los participantes tienen un papel importante. ",1.0,"['buen', 'maestro', 'ver', 'gustar', 'temario', 'clase', 'forma', 'enseñar', 'mediante', 'trabajo', 'equipo', 'organización', 'proyecto', 'participante', 'papel', 'importante']"
833,1.0,1.0,1.0,1.0,1.0,1.0,1.0,1.0,1.0,0,93.84,1.0,1,Busca otras alternativas para aprender conceptos que de otra forma pudieran ser aburridos. ,1.0,"['buscar', 'alternativa', 'aprender', 'concepto', 'forma', 'poder', 'ser', 'aburrido']"
834,0.0,0.0,1.0,0.0,0.0,0.0,0.0,0.0,0.0,1,83.527,1.0,2,"Es simpático, el curso es tranquilo, hay puntos extras con actividades. Siento que se pierde mucho tiempo en las clases, no me parece que sea culpa del profesor, solo me da la impresión que muchas cosas dentro del curso eran de relleno.",0.0,"['simpático', 'curso', 'tranquilo', 'punto', 'extra', 'actividad', 'sentir', 'perder', 'tiempo', 'clase', 'no', 'parecer', 'culpa', 'profesor', 'solo', 'dar', 'impresión', 'mucho', 'cosa', 'dentro', 'curso', 'relleno']"
835,0.0,0.0,0.0,0.0,0.0,1.0,0.0,0.0,1.0,1,90.653,1.0,2,"Todo bien. Mucha lectura y resumen, considero que el libro que hay que leer no es muy bueno",0.0,"['bien', 'mucho', 'lectura', 'resumir', 'considerar', 'libro', 'leer', 'no', 'buen']"
836,0.0,0.0,0.0,0.0,0.0,0.0,0.0,0.0,0.0,0,96.657,1.0,0, No se me hace una buena forma de evaluar el examen final dado que algunos alumnos no cuentan con las mismas habilidades que otro lo que puede perjudicar la calificación del alumno.,0.0,"['no', 'hacer', 'buen', 'forma', 'evaluar', 'examen', 'final', 'dado', 'alumno', 'no', 'contar', 'mismo', 'habilidad', 'poder', 'perjudicar', 'calificación', 'alumno']"
837,1.0,1.0,1.0,1.0,0.0,0.0,1.0,1.0,1.0,0,94.4,1.0,2,Al tener la mitad de la clase de teoría y la mitad de la clase práctica la hace muy dinámica y aplicas lo que aprendes. El principio de la clase puede resultar algo lenta.,1.0,"['tener', 'mitad', 'clase', 'teoría', 'mitad', 'clase', 'práctico', 'hacer', 'dinámica', 'aplicar', 'aprender', 'principio', 'clase', 'poder', 'resultar', 'lento']"
838,1.0,1.0,1.0,0.0,1.0,1.0,1.0,1.0,1.0,0,95.8,1.0,1,Buen profesor y buen método de enseñanza. ,1.0,"['buen', 'profesor', 'buen', 'método', 'enseñanza']"
839,1.0,1.0,1.0,0.0,1.0,1.0,1.0,1.0,1.0,0,88.717,1.0,1,"La manera en que da la clase es dinámica, práctica, diferente y siempre está disponible. ",1.0,"['manera', 'dar', 'clase', 'dinámico', 'práctico', 'diferente', 'siempre', 'disponible']"
840,1.0,1.0,1.0,0.0,0.0,1.0,0.0,1.0,1.0,0,93.285,1.0,1,"bien, pero un poco monótona ",1.0,"['bien', 'monótono']"
841,1.0,1.0,0.0,1.0,0.0,0.0,1.0,0.0,1.0,0,85.215,1.0,1,Justo y un maestro muy inteligente ,1.0,"['justo', 'maestro', 'inteligente']"
842,0.0,1.0,1.0,1.0,0.0,0.0,1.0,0.0,1.0,1,92.44,1.0,2,muy buena persona Si la recomendaria,1.0,"['buen', 'persona', 'si', 'recomendar']"
843,0.0,0.0,0.0,0.0,0.0,0.0,0.0,0.0,0.0,1,89.243,1.0,0," No explica del todo bien, muchas veces sus explicaciones son distantes a como las manejan los libros. En su clase se la pasa filosofando por 1 hora entera.",0.0,"['no', 'explicar', 'bien', 'mucho', 'vez', 'explicación', 'distante', 'manejar', 'libro', 'clase', 'pasar', 'filosofando', '1', 'hora', 'entero']"
844,1.0,1.0,0.0,1.0,0.0,0.0,0.0,1.0,0.0,1,87.739,1.0,1,buen maestro ,0.0,"['buen', 'maestro']"
845,1.0,1.0,1.0,1.0,1.0,1.0,1.0,1.0,1.0,1,79.766,1.0,2,"MUY BUENA DINAMICA, UTILIZAMOS LEGOS PARA SIMULAR LINEAS DE PRODUCCION Y CADENAS CRITICAS NADA",1.0,"['buen', 'dinamica', 'utilizar', 'lego', 'simular', 'linea', 'produccion', 'cadena', 'critico']"
846,1.0,1.0,1.0,1.0,1.0,1.0,1.0,0.0,1.0,1,83.47,1.0,1,Sus clases son tranquilas y los proyectos son muy interactivos ,1.0,"['clase', 'tranquilo', 'proyecto', 'interactivo']"
847,0.0,1.0,0.0,0.0,0.0,0.0,0.0,0.0,0.0,1,87.478,1.0,2,Deja buenas enseñanzas y te da otra perspectiva de adm. de proyectos Parece que ya tiene todo su material de hace años y no lo ha modificado para adaptarse,0.0,"['dejar', 'buen', 'enseñanza', 'dar', 'perspectiva', 'adm', 'proyecto', 'parecer', 'material', 'hacer', 'año', 'no', 'modificado', 'adaptar', 'él']"
848,0.0,1.0,1.0,0.0,0.0,1.0,0.0,0.0,1.0,1,76.571,1.0,1,"Has a lot of knowledge, teaches in a practical fashion. ",0.0,"['lot', 'of', 'knowledge', 'teache', 'in', 'practical', 'fashion']"
849,1.0,1.0,0.0,0.0,0.0,1.0,1.0,1.0,0.0,0,86.419,1.0,1,"Si clase es entretenida, aprendes los conceptos por aplicaciones ",1.0,"['si', 'clase', 'entretenido', 'aprender', 'concepto', 'aplicación']"
850,1.0,1.0,0.0,1.0,1.0,1.0,1.0,0.0,1.0,0,93.465,1.0,1,"Excelente profesor, enseña con una metodología 100% práctica que se ajusta muy bien al tipo de contenido que implica la materia ",1.0,"['excelente', 'profesor', 'enseñar', 'metodología', '100', 'práctica', 'ajustar', 'bien', 'tipo', 'contenido', 'implicar', 'materia']"
851,1.0,1.0,1.0,0.0,1.0,0.0,1.0,1.0,1.0,1,88.562,1.0,1,Excelente profesor. Sabe mucho sobre la materia y relaciona las actividades de la clase con situaciones de la vida real. ,1.0,"['excelente', 'profesor', 'saber', 'materia', 'relacionar', 'actividad', 'clase', 'situación', 'vida', 'real']"
852,0.0,1.0,1.0,0.0,0.0,1.0,0.0,1.0,1.0,0,87.53,1.0,2,Es buen profesor y se nota el esfuerzo que le pone a sus clases. La carga de trabajo es excesiva.,0.0,"['buen', 'profesor', 'notar', 'esfuerzo', 'poner', 'clase', 'cargar', 'trabajo', 'excesivo']"
853,1.0,1.0,1.0,0.0,1.0,0.0,1.0,0.0,0.0,0,81.4,1.0,1,Muy comprometido con sus alumnos ,1.0,"['comprometido', 'alumno']"
854,0.0,1.0,0.0,1.0,0.0,0.0,1.0,0.0,1.0,1,92.44,1.0,2,muy buena persona Si la recomendaria,1.0,"['buen', 'persona', 'si', 'recomendar']"
855,0.0,1.0,0.0,0.0,0.0,0.0,0.0,0.0,0.0,1,81.392,1.0,0, Es mucho trabajo en todo el semestre,0.0,"['trabajo', 'semestre']"
856,1.0,1.0,1.0,1.0,1.0,1.0,1.0,1.0,1.0,0,98.111,1.0,1,Las actividades que hacemos en clase son super interesantes. ,1.0,"['actividad', 'hacer', 'clase', 'super', 'interesante']"
857,0.0,0.0,0.0,0.0,0.0,0.0,0.0,0.0,0.0,0,95.338,1.0,1,Pones en práctica los temas de la clase mediante una simulación de una línea de producción y considero que es la mejor manera de aprender. ,0.0,"['poner', 'práctica', 'tema', 'clase', 'mediante', 'simulación', 'línea', 'producción', 'considerar', 'mejor', 'manera', 'aprender']"
858,1.0,1.0,1.0,1.0,1.0,1.0,1.0,1.0,1.0,1,93.923,1.0,1,"Excelente ánimo y dominio del tema. La clase es especialmente cautivadora por su naturaleza interactiva, y creo que es un ejemplo que otras clases deberían seguir. ",1.0,"['excelente', 'ánimo', 'dominio', 'tema', 'clase', 'especialmente', 'cautivador', 'naturaleza', 'interactivo', 'creer', 'ejemplo', 'clase', 'deber', 'seguir']"
859,1.0,1.0,1.0,1.0,1.0,1.0,1.0,1.0,1.0,1,83.49,1.0,1,Otro rollo ,1.0,['rollo']
860,1.0,0.0,0.0,0.0,1.0,1.0,1.0,0.0,0.0,0,97.8,1.0,2,Actividades interesantes La primera hora y media de la clase no hacemos nada,1.0,"['actividad', 'interesante', 'primero', 'hora', 'medio', 'clase', 'no', 'hacer']"
861,1.0,1.0,1.0,1.0,1.0,1.0,1.0,1.0,1.0,1,92.452,1.0,1,"Muy buen profe, con muchos ejemplos de su vida que son perfectos para los temas que estamos llevando. De verdad el profesor que te da gusto llevar clase, pues la da con gusto. ",1.0,"['buen', 'profe', 'ejemplo', 'vida', 'perfecto', 'tema', 'llevar', 'verdad', 'profesor', 'dar', 'gusto', 'llevar', 'clase', 'pues', 'dar', 'gusto']"
862,1.0,1.0,0.0,1.0,1.0,1.0,1.0,1.0,1.0,0,81.361,1.0,1,Tiene conocimiento ,1.0,['conocimiento']
863,1.0,0.0,0.0,1.0,1.0,0.0,0.0,1.0,0.0,1,82.5,1.0,1,Excelente clase. Muy interactiva ,1.0,"['excelente', 'clase', 'interactivo']"
864,0.0,1.0,0.0,0.0,0.0,0.0,0.0,0.0,0.0,0,96.809,1.0,2,Profesor con mucho conocimiento Clases tediosas,0.0,"['profesor', 'conocimiento', 'clase', 'tedioso']"
865,0.0,1.0,0.0,1.0,1.0,1.0,0.0,0.0,1.0,1,89.272,1.0,2,"Sus clases son totalmente practicas y entretenidas, el profesor es tranquilo Es bastante estricto en sus actividades practicas",1.0,"['clase', 'totalmente', 'practico', 'entretenido', 'profesor', 'tranquilo', 'bastante', 'estricto', 'actividad', 'practico']"
866,1.0,1.0,0.0,0.0,0.0,1.0,1.0,0.0,1.0,1,94.311,1.0,1,"Su clase es muy interactiva y práctica, haciendo que el aprendizaje sea más visual y fácil de lograr. ",1.0,"['clase', 'interactivo', 'práctico', 'hacer', 'aprendizaje', 'visual', 'fácil', 'lograr']"
867,1.0,1.0,1.0,0.0,1.0,1.0,1.0,1.0,1.0,0,96.629,1.0,1,Clses muy dinámicas ,1.0,"['clse', 'dinámico']"
868,1.0,1.0,1.0,1.0,1.0,1.0,1.0,1.0,1.0,1,82.933,1.0,1,"Definitivamente de los mejores cursos que he tomado en el TEC, aprendes al hacer sin involucrar tanto memorizar conceptos. Todo se pone en practica. ",1.0,"['definitivamente', 'mejor', 'curso', 'tomado', 'tec', 'aprender', 'hacer', 'involucrar', 'memorizar', 'concepto', 'poner', 'practicar']"
869,0.0,0.0,0.0,0.0,0.0,0.0,0.0,0.0,0.0,1,81.533,1.0,1,"Es un profesor que busca cambiar la dinámica de la clase, mediante creando un grupo en todo el salón, desarrollar el trabajo en equipo, mediante la utilización de diferentes materiales didácticos que permiten aplicar varios temas que has ido viendo en el transcurso de la clase ",0.0,"['profesor', 'buscar', 'cambiar', 'dinámico', 'clase', 'mediante', 'crear', 'grupo', 'salón', 'desarrollar', 'trabajo', 'equipo', 'mediante', 'utilización', 'diferente', 'material', 'didáctico', 'permitir', 'aplicar', 'varios', 'tema', 'ir', 'ver', 'transcurso', 'clase']"
870,1.0,1.0,0.0,1.0,1.0,1.0,0.0,0.0,1.0,0,86.666,1.0,2,Su clase es interactiva e interesante. Te ayuda a facilitar el aprendizaje. si lo recomiendo,1.0,"['clase', 'interactivo', 'interesante', 'ayudar', 'facilitar', 'aprendizaje', 'si', 'recomer']"
