466,0.0,0.0,1.0,0.0,0.0,0.0,0.0,0.0,0.0,1,94.227,1.0,2,"La clase será relajada Ineficiente método de enseñanza, no logras aprender lo necesario.",0.0,"['clase', 'relajado', 'ineficiente', 'método', 'enseñanza', 'no', 'lograr', 'aprender', 'necesario']"
467,1.0,1.0,1.0,0.0,1.0,1.0,1.0,1.0,1.0,1,75.384,1.0,1,Buena clase ,1.0,"['buen', 'clase']"
468,1.0,0.0,0.0,1.0,1.0,0.0,0.0,0.0,1.0,0,98.3,1.0,1,Buen profesor. ,1.0,"['buen', 'profesor']"
469,1.0,1.0,1.0,1.0,1.0,1.0,1.0,1.0,1.0,1,81.0,1.0,1,experiencia nueva y aprendizaje de la materia ,1.0,"['experiencia', 'nuevo', 'aprendizaje', 'materia']"
470,0.0,0.0,0.0,0.0,0.0,0.0,0.0,0.0,0.0,1,85.5,1.0,2,Es paciente y apoya a los alumnos. Falta mucho a clases.,0.0,"['paciente', 'apoyar', 'alumno', 'falta', 'clase']"
471,1.0,1.0,1.0,1.0,1.0,1.0,1.0,1.0,1.0,1,92.416,1.0,1,"Excelente profesor, buena manera de enseñar. ",1.0,"['excelente', 'profesor', 'buen', 'manera', 'enseñar']"
472,1.0,1.0,1.0,1.0,1.0,1.0,1.0,1.0,1.0,0,89.714,1.0,2,Muy buen maestro Porque a veces falta mucho,1.0,"['buen', 'maestro', 'vez', 'falta']"
473,0.0,1.0,0.0,0.0,0.0,0.0,0.0,0.0,0.0,1,91.666,1.0,2,No podría dar un opinión clara al respecto. No podría dar un opinión clara al respecto.,0.0,"['no', 'poder', 'dar', 'opinión', 'claro', 'respecto', 'no', 'poder', 'dar', 'opinión', 'claro', 'respecto']"
474,1.0,1.0,1.0,1.0,1.0,1.0,1.0,0.0,1.0,1,77.24,1.0,1,clase muy entretenida ,1.0,"['clase', 'entretenido']"
475,0.0,1.0,1.0,0.0,1.0,0.0,0.0,0.0,1.0,1,83.425,1.0,2,El profesor siempre es muy amable con el alumno está dispuesto apoyar en cuanto sea necesario No comarto la idea que los alumnos presenten muy seguido en las clases,1.0,"['profesor', 'siempre', 'amable', 'alumno', 'dispuesto', 'apoyar', 'cuanto', 'necesario', 'no', 'comar', 'idea', 'alumno', 'presentar', 'seguido', 'clase']"
476,0.0,1.0,0.0,1.0,1.0,1.0,1.0,0.0,0.0,1,83.289,1.0,1,buena forma de enseñar ,1.0,"['buen', 'forma', 'enseñar']"
477,0.0,0.0,0.0,0.0,0.0,0.0,0.0,0.0,0.0,0,91.423,1.0,2,"no lo recomendaría se toma a juego la clase, no da las clases NUNCA el y su manera de calificar no es optima.",0.0,"['no', 'recomendar', 'tomar', 'juego', 'clase', 'no', 'dar', 'clase', 'nunca', 'manera', 'calificar', 'no', 'optimo']"
478,1.0,1.0,1.0,1.0,1.0,1.0,1.0,1.0,1.0,1,91.837,1.0,1,Muy claro los conceptos ,1.0,"['claro', 'concepto']"
479,1.0,1.0,1.0,1.0,1.0,1.0,1.0,0.0,1.0,1,83.81,1.0,1,"Incentiva a los alumnos a participar mediante presentaciones. El revisa las presentaciones de los alumnos previo a que se presenten a la clase, lo cual indica su atención al contenido de clase. ",1.0,"['incentivar', 'alumno', 'participar', 'mediante', 'presentación', 'revisar', 'presentación', 'alumno', 'previo', 'presentar', 'clase', 'indicar', 'atención', 'contenido', 'clase']"
480,1.0,1.0,1.0,1.0,1.0,1.0,1.0,1.0,1.0,1,90.157,1.0,1,"Sabe mucho del tema y ejemplifica con casos prácticos de la vida real, lleva los temás más allá de lo obvio. ",1.0,"['saber', 'tema', 'ejemplificar', 'caso', 'práctico', 'vida', 'real', 'llevar', 'temás', 'allá', 'obvio']"
481,1.0,0.0,0.0,0.0,0.0,0.0,0.0,0.0,0.0,1,93.076,1.0,2,Tiene un dominio muy fuerte de la materia. La forma de dar la materia a veces deja lagunas.,0.0,"['dominio', 'fuerte', 'materia', 'forma', 'dar', 'materia', 'vez', 'dejar', 'laguna']"
482,1.0,1.0,1.0,1.0,0.0,1.0,0.0,0.0,0.0,0,91.315,1.0,1,"Sabe de todo, explica muy bien. ",1.0,"['saber', 'todo', 'explicar', 'bien']"
483,0.0,0.0,0.0,0.0,0.0,0.0,0.0,0.0,1.0,1,85.675,1.0,2,"cubre todos los temas y da ejemplos Las presentaciones las dan los alumnos, que no tienen la misma agilidad que tendría el profesor",0.0,"['cubrir', 'tema', 'dar', 'ejemplo', 'presentación', 'dar', 'alumno', 'no', 'mismo', 'agilidad', 'profesor']"
484,1.0,1.0,1.0,0.0,0.0,0.0,1.0,0.0,0.0,0,91.868,1.0,2,"Es un profesor sumamente conocedor de la materia. Además es muy agradable, y hace la clase muy amena. Me hubiera gustado que la clase fuera más práctica, y nos tocara redactar e incluso revisar los contratos vistos en clase. También me hubiera gustado resolver casos prácticos de la vida real, y discutir con los compañeros un intercambio de ideas, y que el profesor nos explicara cómo resolverlo y nos diera tips de negociación.  La clase fue sumamente teórica, y todas las clases fueron dadas por los compañeros; me hubiera gustado que el profesor participara en la enseñara del curso.",1.0,"['profesor', 'sumamente', 'conocedor', 'materia', 'además', 'agradable', 'hacer', 'clase', 'ameno', 'gustar', 'clase', 'práctico', 'tocar', 'redactar', 'incluso', 'revisar', 'contrato', 'visto', 'clase', 'gustar', 'resolver', 'caso', 'práctico', 'vida', 'real', 'discutir', 'compañero', 'intercambio', 'idea', 'profesor', 'explicar', 'cómo', 'resolver', 'él', 'dar', 'tip', 'negociación', 'clase', 'sumamente', 'teórico', 'todo', 'clase', 'dado', 'compañero', 'gustar', 'profesor', 'participar', 'enseñar', 'curso']"
485,0.0,0.0,0.0,0.0,0.0,1.0,0.0,0.0,0.0,1,70.166,1.0,2,Aprendizaje efectivo y rápido Frecuentemente está muy ocupado con otros alumnos,0.0,"['aprendizaje', 'efectivo', 'rápido', 'frecuentemente', 'ocupado', 'alumno']"
486,1.0,1.0,1.0,0.0,1.0,1.0,1.0,1.0,1.0,1,88.391,1.0,1,Bastante bien ,1.0,"['bastante', 'bien']"
487,1.0,1.0,1.0,1.0,1.0,1.0,1.0,1.0,1.0,0,81.647,1.0,2,Tiene paciencia Da poco tiempo para entregar trabajos,1.0,"['paciencia', 'dar', 'tiempo', 'entregar', 'trabajo']"
488,1.0,1.0,1.0,0.0,1.0,1.0,0.0,1.0,1.0,1,85.851,1.0,2,"Muy atento y da tareas retador as, las cuales son perfecta práctica para el examen. Sus explicaciones llegan a ser incompletas",1.0,"['atento', 'dar', 'tarea', 'retador', 'as', 'cual', 'perfecto', 'práctica', 'examen', 'explicación', 'llegar', 'ser', 'incompleto']"
489,1.0,1.0,1.0,1.0,1.0,1.0,1.0,1.0,1.0,1,86.115,1.0,2,"Es un profesor que domina bastante, además, de que nos pone actividades que nos ayuda a comprender mejor el tema y da retroalimentación de ellas. No  tengo ningún problema con su forma de enseñar.",1.0,"['profesor', 'dominar', 'bastante', 'además', 'poner', 'actividad', 'ayuda', 'comprender', 'mejor', 'tema', 'dar', 'retroalimentación', 'él', 'no', 'ninguno', 'problema', 'forma', 'enseñar']"
490,1.0,1.0,1.0,1.0,1.0,1.0,1.0,1.0,1.0,1,79.35,1.0,1,Enseña de una forma muy agradable ,1.0,"['enseñar', 'forma', 'agradable']"
491,1.0,1.0,1.0,1.0,1.0,1.0,1.0,1.0,1.0,1,95.642,1.0,1,Amplio dominio del programa que se utiliza ,1.0,"['amplio', 'dominio', 'programa', 'utilizar']"
492,1.0,1.0,1.0,1.0,1.0,1.0,1.0,1.0,1.0,1,91.142,1.0,1,Resuelve todas tus dudas hasta que entiendas ,1.0,"['resolver', 'todo', 'duda', 'entender']"
493,1.0,1.0,1.0,1.0,1.0,1.0,1.0,1.0,1.0,0,90.44,1.0,1,Conoce muy bien el software ,1.0,"['conocer', 'bien', 'software']"
494,0.0,1.0,1.0,0.0,0.0,0.0,0.0,0.0,1.0,1,89.923,1.0,1,Apoya mucho a los alumnos que no saben ,0.0,"['apoyar', 'alumno', 'no', 'saber']"
495,1.0,0.0,1.0,0.0,0.0,0.0,0.0,1.0,0.0,1,85.074,1.0,1,Siempre atento a las dudas ,1.0,"['siempre', 'atento', 'duda']"
496,0.0,0.0,0.0,0.0,0.0,0.0,0.0,1.0,1.0,1,80.416,0.0,0, La forma en la que califica es muy injusta. Es demasiado especial si tienes un pequeñito error en la practica y eso hace que te baje muchos puntos.,0.0,"['forma', 'calificar', 'injusto', 'demasiado', 'especial', 'si', 'pequeñito', 'error', 'practicar', 'hacer', 'bajar', 'punto']"
497,1.0,1.0,1.0,1.0,1.0,1.0,1.0,1.0,1.0,1,83.8,0.0,1,"Explica muy detallado todo el contenido del curso, muy amable y paciente. ",1.0,"['explicar', 'detallado', 'contenido', 'curso', 'amable', 'paciente']"
498,1.0,1.0,1.0,1.0,1.0,1.0,1.0,1.0,1.0,1,77.538,0.0,1,Tiene un gran dominio de los temas y es una muy buena maestra. La clase es clara e interactiva. ,1.0,"['gran', 'dominio', 'tema', 'buen', 'maestro', 'clase', 'claro', 'interactivo']"
499,1.0,1.0,1.0,1.0,1.0,1.0,1.0,1.0,1.0,1,79.642,0.0,2,Enseña muy bien y quiere que aprendas Clase muy cargada,1.0,"['enseñar', 'bien', 'querer', 'aprender', 'clase', 'cargado']"
500,0.0,0.0,0.0,0.0,0.0,0.0,0.0,0.0,0.0,1,82.214,0.0,2,No Pésima explicando,0.0,"['no', 'pésimo', 'explicar']"
501,0.0,0.0,0.0,0.0,0.0,0.0,0.0,0.0,0.0,1,85.562,0.0,1,La maestra Luzma entiende muy bien los temas y siempre esta lista para ayudar a sus estudiantes. También te da la opción de reponer un laboratorio si llegas con ella a tiempo. Ella es muy comprensiva de la situación de muchos alumnos. ,0.0,"['maestro', 'luzmo', 'entender', 'bien', 'tema', 'siempre', 'listo', 'ayudar', 'estudiante', 'dar', 'opción', 'reponer', 'laboratorio', 'si', 'llegar', 'tiempo', 'comprensivo', 'situación', 'alumno']"
502,1.0,1.0,0.0,1.0,1.0,1.0,0.0,1.0,1.0,1,85.333,0.0,1,"Porque a pesar de ser estricta es una maestra que le echa muchas ganas a su clase e inspira a sus alumnos, al igual que es muy capaz de mantener el control de sus alumnos. ",1.0,"['pesar', 'ser', 'estricto', 'maestro', 'echar', 'mucho', 'gana', 'clase', 'inspirar', 'alumno', 'igual', 'capaz', 'mantener', 'control', 'alumno']"
503,0.0,1.0,1.0,1.0,1.0,1.0,0.0,1.0,0.0,1,73.538,0.0,2,Es una gran profesora y sabe lo que hace. Apoya a los alumnos y lo hace de la mejor manera. si la recomiendo,1.0,"['gran', 'profesora', 'saber', 'hacer', 'apoyar', 'alumno', 'hacer', 'mejor', 'manera', 'si', 'recomer']"
504,1.0,1.0,0.0,1.0,0.0,0.0,1.0,1.0,1.0,1,91.846,0.0,1,Explica bastante bien y hace que las pacticas sean mas amenas ,1.0,"['explicar', 'bastante', 'bien', 'hacer', 'pactica', 'mas', 'ameno']"
505,0.0,0.0,0.0,1.0,0.0,0.0,0.0,0.0,0.0,0,89.785,0.0,1,Sus explicaciones son muy faciles de enteder ,0.0,"['explicación', 'facil', 'enteder']"
506,0.0,0.0,0.0,0.0,0.0,0.0,0.0,0.0,0.0,1,72.785,0.0,1,Las practicas se entienden ,0.0,"['practica', 'entender']"
507,1.0,1.0,1.0,1.0,1.0,1.0,1.0,1.0,1.0,1,87.5,0.0,1,"Es muy buena para explicar, muy claro y con mucha paciencia, siempre resuelve todas las dudas y lo hace con distintos procedimientos para que se pueda comprender mejor ",1.0,"['buen', 'explicar', 'claro', 'mucho', 'paciencia', 'siempre', 'resolver', 'todo', 'duda', 'hacer', 'distinto', 'procedimiento', 'poder', 'comprender', 'mejor']"
508,0.0,1.0,0.0,0.0,0.0,1.0,0.0,0.0,1.0,0,84.416,0.0,2,Explica muy bien el proceso del laboratorio y si tienes dudas las resuelve A veces se tarda mucho en la explicación lo cual aburre y no tenemos mucho tiempo para hacer la práctica.,1.0,"['explicar', 'bien', 'proceso', 'laboratorio', 'si', 'duda', 'resolver', 'vez', 'tardar', 'explicación', 'aburrir', 'no', 'tiempo', 'hacer', 'práctica']"
509,1.0,1.0,1.0,1.0,1.0,1.0,0.0,0.0,0.0,1,84.269,0.0,1,Muy buena maestra ,1.0,"['buen', 'maestro']"
510,0.0,1.0,0.0,0.0,0.0,0.0,1.0,0.0,0.0,0,80.222,0.0,1,Se apasiona por su laboratorio ,0.0,"['apasionar', 'laboratorio']"
511,1.0,1.0,1.0,0.0,1.0,1.0,1.0,1.0,1.0,1,91.923,0.0,1,Siempre quiere que los laboratorios salgan de la mejor manera posible y busca lo que es mejor para ellos. ,1.0,"['siempre', 'querer', 'laboratorio', 'salir', 'mejor', 'manera', 'posible', 'buscar', 'mejor', 'él']"
512,1.0,1.0,1.0,1.0,1.0,1.0,1.0,1.0,1.0,1,78.692,0.0,1,Porque sus metodologías son buenas para el aprendizaje. ,1.0,"['metodología', 'buen', 'aprendizaje']"
513,0.0,1.0,1.0,1.0,1.0,1.0,0.0,1.0,1.0,1,85.0,0.0,2,Por la forma organizada en que se maneja la clase A veces no da tanto tiempo para hacer las prácticas,1.0,"['forma', 'organizado', 'manejar', 'clase', 'vez', 'no', 'dar', 'tiempo', 'hacer', 'práctica']"
514,1.0,1.0,1.0,0.0,1.0,0.0,0.0,1.0,1.0,1,90.076,0.0,1,"Si quieres aprender, puedes hacerlo con ella, a veces es un poco cansado llegar al laboratorio cuando tenemos muchas tareas o pendientes, por eso el grupo se distrae. ",1.0,"['si', 'querer', 'aprender', 'poder', 'hacer', 'él', 'él', 'vez', 'cansado', 'llegar', 'laboratorio', 'mucho', 'tarea', 'pendiente', 'grupo', 'distraer']"
515,1.0,1.0,1.0,1.0,1.0,1.0,1.0,1.0,1.0,1,84.705,0.0,1,buena metodología ,1.0,"['buen', 'metodología']"
516,1.0,1.0,1.0,0.0,1.0,1.0,1.0,1.0,1.0,1,83.769,0.0,2,Excelente maesta Todo bien,1.0,"['excelente', 'maesta', 'bien']"
517,1.0,1.0,0.0,0.0,0.0,1.0,0.0,0.0,0.0,1,90.857,0.0,1,Sabe explicar muy bien la clase y domina los temas ,1.0,"['saber', 'explicar', 'bien', 'clase', 'dominar', 'tema']"
518,1.0,1.0,1.0,1.0,1.0,1.0,1.0,1.0,1.0,1,88.214,0.0,1,Explica muy bien el laboratorio de física. ,1.0,"['explicar', 'bien', 'laboratorio', 'físico']"
519,1.0,1.0,0.0,0.0,1.0,1.0,0.0,0.0,1.0,0,76.538,0.0,1,Utiliza herramientas que te facilitan el aprenidzaje del tema ,1.0,"['utilizar', 'herramienta', 'facilitar', 'aprenidzaje', 'tema']"
520,1.0,1.0,1.0,1.0,1.0,1.0,1.0,1.0,1.0,1,91.0,0.0,1,"Muy buena maestra, explica muy bien. ",1.0,"['buen', 'maestro', 'explicar', 'bien']"
521,1.0,1.0,1.0,0.0,1.0,1.0,1.0,1.0,1.0,1,62.761,0.0,2,Experta en el tema ningun motivo,1.0,"['experta', 'tema', 'ninguno', 'motivo']"
522,1.0,1.0,1.0,0.0,1.0,1.0,1.0,1.0,1.0,1,71.0,0.0,1,Buena maestra ,1.0,"['buen', 'maestro']"
523,1.0,1.0,1.0,1.0,1.0,1.0,1.0,1.0,1.0,1,86.666,0.0,2,Es una docente altamente preparada que sabe cómo facilitar las explicaciones para la comprensión de los temas que imparte. N/d.,1.0,"['docente', 'altamente', 'preparado', 'saber', 'cómo', 'facilitar', 'explicación', 'comprensión', 'tema', 'impartir', 'nd']"
524,1.0,1.0,1.0,1.0,1.0,1.0,1.0,1.0,0.0,1,82.545,0.0,2,"Sabe mucho, sabe explicar y acercarse con los alumnos si lo recomiendo",1.0,"['saber', 'mucho', 'saber', 'explicar', 'acercar', 'él', 'alumno', 'si', 'recomer']"
525,1.0,1.0,1.0,0.0,1.0,1.0,1.0,1.0,1.0,0,91.384,0.0,1,Porque es paciente y explica bien ,1.0,"['paciente', 'explicar', 'bien']"
526,1.0,1.0,1.0,1.0,1.0,1.0,1.0,1.0,1.0,1,92.166,0.0,1,Si la recomiendo porque da todo lo suyo para enseñar ,1.0,"['si', 'recomer', 'dar', 'enseñar']"
527,1.0,1.0,0.0,1.0,0.0,1.0,1.0,1.0,0.0,0,92.923,0.0,1,Es muy buena explicando y te permite desarrollar el pensamiento lógico. Relaciona muy bien lo experimental con la teoría ,1.0,"['buen', 'explicar', 'permitir', 'desarrollar', 'pensamiento', 'lógico', 'relacionar', 'bien', 'experimental', 'teoría']"
528,0.0,1.0,1.0,0.0,1.0,1.0,0.0,0.0,0.0,1,91.692,0.0,2,"Sabe bastante, y brinda explicaciones claras Si lo recomendaría",0.0,"['saber', 'bastante', 'brindar', 'explicación', 'claro', 'si', 'recomendar']"
529,1.0,1.0,0.0,1.0,1.0,1.0,0.0,1.0,1.0,1,90.909,0.0,1,Me gusta su forma de trabajar ,1.0,"['gustar', 'forma', 'trabajar']"
530,0.0,1.0,0.0,0.0,1.0,1.0,1.0,0.0,1.0,1,69.842,0.0,1,"Da muy bien su laboratorio, le gusta. ",0.0,"['dar', 'bien', 'laboratorio', 'gustar']"
531,1.0,1.0,1.0,1.0,1.0,1.0,1.0,1.0,1.0,1,90.0,0.0,1,Por sus conocimientos en fisica experimental ,1.0,"['conocimiento', 'fisico', 'experimental']"
532,1.0,1.0,1.0,1.0,1.0,1.0,1.0,1.0,1.0,0,78.285,0.0,1,Es el segundo semestre que llevo clases con ella y me gusta su clase ,1.0,"['segundo', 'semestre', 'llevar', 'clase', 'gustar', 'clase']"
533,1.0,1.0,1.0,1.0,1.0,1.0,1.0,1.0,1.0,1,87.0,0.0,1,bien ,1.0,['bien']
534,0.0,0.0,0.0,0.0,1.0,0.0,1.0,0.0,1.0,1,87.0,0.0,1,porque explica muy bien ,0.0,"['explicar', 'bien']"
535,0.0,0.0,1.0,0.0,0.0,0.0,0.0,0.0,1.0,1,79.727,0.0,2,Es buena haciendo las presentaciones para reforzar los temas pero en el laboratorio aveces se vuelve complicado porque esta muy ocupada con todos los equipos Esta muy sobresaturada a la hora de hacer las practicas,0.0,"['buen', 'hacer', 'presentación', 'reforzar', 'tema', 'laboratorio', 'avez', 'volver', 'complicado', 'ocupado', 'equipo', 'sobresaturado', 'hora', 'hacer', 'practica']"
536,1.0,1.0,1.0,1.0,1.0,1.0,1.0,1.0,1.0,1,95.642,0.0,2,Comprensible Discordia,1.0,"['comprensible', 'discordia']"
537,0.0,1.0,0.0,1.0,1.0,1.0,1.0,0.0,1.0,0,89.23,0.0,1,Me gusta como explica los temas de las practicas y es muy paciente en la clase. Es muy buena maestra. ,1.0,"['gustar', 'explicar', 'tema', 'practico', 'paciente', 'clase', 'buen', 'maestro']"
538,1.0,1.0,1.0,1.0,1.0,1.0,1.0,1.0,1.0,0,91.75,0.0,1,"Sus explicaciones son muy claras y prácticas, siempre ejemplifica con casos reales, lo cual nos ayuda a comprender mejor el objetivo de un tema. Tiene la mejor actitud, es excelente. ",1.0,"['explicación', 'claro', 'práctico', 'siempre', 'ejemplificar', 'caso', 'real', 'ayudar', 'comprender', 'mejor', 'objetivo', 'tema', 'mejor', 'actitud', 'excelente']"
539,1.0,1.0,1.0,1.0,1.0,1.0,1.0,1.0,1.0,1,95.153,0.0,1,"Es una maestra adecuada para la clase de laboratorio, resuelve todas las dudas. ",1.0,"['maestro', 'adecuado', 'clase', 'laboratorio', 'resolver', 'todo', 'duda']"
540,1.0,1.0,0.0,1.0,1.0,1.0,1.0,1.0,1.0,1,97.428,0.0,1,"La maestra tiene amplio dominio de los temas del laboratorio, da explicaciones muy claras. La clase es algo rápida por el poco tiempo pero siempre está dispuesta a resolver dudas. ",1.0,"['maestro', 'amplio', 'dominio', 'tema', 'laboratorio', 'dar', 'explicación', 'claro', 'clase', 'rápido', 'tiempo', 'siempre', 'dispuesto', 'resolver', 'duda']"
541,1.0,1.0,1.0,1.0,1.0,1.0,1.0,1.0,1.0,1,66.88,0.0,1,"Muy buena maestra, clase muy interesante ",1.0,"['buen', 'maestro', 'clase', 'interesante']"
542,1.0,1.0,1.0,0.0,0.0,1.0,1.0,1.0,1.0,1,81.5,0.0,1,"Es una maestra la cual se ve que si le pone pasión a su clase, y le gusta impartirla. ",1.0,"['maestro', 'ver', 'si', 'poner', 'pasión', 'clase', 'gustar', 'impartir', 'él']"
543,0.0,1.0,0.0,1.0,0.0,0.0,0.0,0.0,0.0,1,81.928,0.0,1,muy buena maestra ,0.0,"['buen', 'maestro']"
544,0.0,0.0,0.0,1.0,0.0,0.0,0.0,0.0,0.0,1,83.25,0.0,2,"Enseña muy bien, es fácil de entender los temas. La recomiendo.",0.0,"['enseñar', 'bien', 'fácil', 'entender', 'tema', 'recomer']"
545,1.0,1.0,1.0,1.0,1.0,1.0,1.0,1.0,1.0,0,98.285,0.0,1,"Me tocaba laboratorio con ella el viernes, y al principio de cada uno daba como un resumen general del tema que hacía que todo lo que veía en la semana me quedara bastante claro lo cual me ayudaba para la clase teórica como la práctica. ",1.0,"['tocar', 'laboratorio', 'viernes', 'principio', 'cada', 'dar', 'resumen', 'general', 'tema', 'hacer', 'ver', 'semana', 'quedar', 'bastante', 'claro', 'ayudar', 'clase', 'teórico', 'práctico']"
546,1.0,1.0,1.0,0.0,1.0,1.0,1.0,1.0,1.0,1,93.846,0.0,2,Muy buenas explicaciones na,1.0,"['buen', 'explicación', 'na']"
547,1.0,1.0,1.0,0.0,1.0,1.0,0.0,0.0,1.0,1,93.846,0.0,2,"Es muy buena maestra, muy paciente para las entregas de los labs y los prelabs, es muy buena onda y siempre trata de ayudarte No aplica, es excelente.",1.0,"['buen', 'maestro', 'paciente', 'entrega', 'lab', 'prelab', 'buen', 'onda', 'siempre', 'tratar', 'ayudar', 'tú', 'no', 'aplicar', 'excelente']"
548,1.0,1.0,1.0,0.0,1.0,1.0,1.0,1.0,1.0,1,91.923,0.0,1,"Es una maestra que siempre esta para ayudar y es muy empática cuando algún alumno no entiende algo, volviéndolo a explicar. ",1.0,"['maestro', 'siempre', 'ayudar', 'empático', 'alguno', 'alumno', 'no', 'entender', 'algo', 'volver', 'él', 'explicar']"
549,1.0,1.0,1.0,1.0,1.0,1.0,1.0,1.0,1.0,1,78.0,0.0,2,sin comentarios sin comentarios,1.0,"['comentario', 'comentario']"
550,0.0,1.0,1.0,1.0,1.0,1.0,1.0,1.0,1.0,0,86.826,0.0,1,Vuelve a retomar los temas que viste con el otro profesor en el laboratorio para asegurarse que no queden dudas ,1.0,"['volver', 'retomar', 'tema', 'ver', 'profesor', 'laboratorio', 'asegurar', 'él', 'no', 'quedar', 'duda']"
551,1.0,1.0,1.0,1.0,1.0,1.0,1.0,1.0,1.0,1,79.916,0.0,2,"Muy buena maestra, ayuda comprender bien el tema Sin comentarios",1.0,"['buen', 'maestro', 'ayudar', 'comprender', 'bien', 'tema', 'comentario']"
552,1.0,1.0,1.0,1.0,1.0,1.0,1.0,1.0,1.0,0,77.478,0.0,1,"Es una excelente maestra, que te ayuda a crecer como estudiante, sus explicaciones son sumamente claras, y estás en una constante mejora. ",1.0,"['excelente', 'maestro', 'ayudar', 'crecer', 'estudiante', 'explicación', 'sumamente', 'claro', 'constante', 'mejora']"
553,0.0,0.0,0.0,0.0,0.0,0.0,0.0,0.0,0.0,1,72.625,0.0,2,es bueno no es bueno,0.0,"['buen', 'no', 'buen']"
554,1.0,1.0,1.0,1.0,1.0,1.0,1.0,1.0,1.0,1,95.75,0.0,1,"Muy buenas explicaciones, metodología y paciencia. ",1.0,"['buen', 'explicación', 'metodologío', 'paciencia']"
555,1.0,1.0,1.0,1.0,1.0,1.0,1.0,0.0,1.0,0,67.604,1.0,1,ENCANTADA CON LA CLASE ,1.0,"['encantado', 'clase']"
556,0.0,0.0,0.0,0.0,0.0,0.0,0.0,0.0,0.0,0,75.51,1.0,1,¿Por qué la mayoría de las veces responde mis dudas en clase al último? ,0.0,"['¿', 'por', 'mayoría', 'vez', 'responder', 'duda', 'clase', 'último']"
557,1.0,1.0,1.0,1.0,1.0,1.0,1.0,1.0,1.0,0,86.44,1.0,1,"Muy bueno explicando, tranquilo y paciente ",1.0,"['buen', 'explicar', 'tranquilo', 'paciente']"
558,0.0,0.0,0.0,0.0,0.0,0.0,0.0,0.0,0.0,1,88.206,1.0,0," Faltó a muchas clases, no explicaba los temas, no hubo exigencia.",0.0,"['faltar', 'mucho', 'clase', 'no', 'explicar', 'tema', 'no', 'exigencia']"
559,0.0,0.0,0.0,0.0,0.0,0.0,0.0,0.0,0.0,1,76.6,1.0,1,Muy buen maestro con mucha experiencia profesional que nos sirve en clase. ,0.0,"['buen', 'maestro', 'mucho', 'experiencia', 'profesional', 'servir', 'clase']"
560,1.0,1.0,1.0,0.0,1.0,1.0,1.0,1.0,1.0,0,90.962,1.0,1,Muy padre sus clases y aprendes muchisimo sobre un tema muy relevante de nuestra carrera. ,1.0,"['padre', 'clase', 'aprender', 'muchisimo', 'tema', 'relevante', 'carrera']"
561,1.0,1.0,1.0,0.0,1.0,1.0,1.0,1.0,1.0,0,91.367,1.0,2,"Muy buen maestro, da ejemplos de la vida real, explica muy bien, da consejos de uso de herramientas muy utiles para el dia a dia y sus clases son entretenidas - Pris si lo recomiendo",1.0,"['buen', 'maestro', 'dar', 'ejemplo', 'vida', 'real', 'explicar', 'bien', 'dar', 'consejo', 'uso', 'herramienta', 'util', 'dia', 'dia', 'clase', 'entretenido', 'pris', 'si', 'recomer']"
562,0.0,0.0,0.0,1.0,0.0,0.0,0.0,0.0,0.0,1,79.812,1.0,2,Muy buen maestro Ninguna queja,0.0,"['buen', 'maestro', 'ninguno', 'queja']"
563,1.0,1.0,1.0,1.0,0.0,1.0,1.0,1.0,1.0,0,88.51,1.0,1,Usa ejemplos muy reales y actualizados ,1.0,"['usar', 'ejemplo', 'real', 'actualizado']"
564,1.0,1.0,1.0,1.0,1.0,1.0,1.0,1.0,1.0,0,83.684,1.0,2,porque aprendes mucho si lo recomiendo,1.0,"['aprender', 'si', 'recomer']"
565,0.0,0.0,0.0,0.0,0.0,0.0,0.0,0.0,0.0,0,93.16,1.0,2,Muy bueno nada,0.0,['buen']
566,0.0,0.0,0.0,0.0,0.0,0.0,0.0,0.0,0.0,1,82.0,0.0,2,"No resuelve una sola duda por mas minima que sea al momento de hacer examen, y eso que nos explica en clase viene en el examen pero de otra manera que no vimos y eso me confunde. Sus explicaciones en clase no son similares a como vienen en las evaluaciones.",0.0,"['no', 'resolver', 'solo', 'duda', 'mas', 'minimo', 'momento', 'hacer', 'examen', 'explicar', 'clase', 'venir', 'examen', 'manera', 'no', 'ver', 'confundir', 'explicación', 'clase', 'no', 'similar', 'venir', 'evaluación']"
567,1.0,1.0,1.0,1.0,1.0,1.0,1.0,1.0,1.0,0,77.545,0.0,1,"Es buena maestra, explica muy bien y se preocupa por que cada uno de sus alumnos entienda cada tema. ",1.0,"['buen', 'maestro', 'explicar', 'bien', 'preocupar', 'cada', 'alumno', 'entender', 'cada', 'tema']"
568,0.0,1.0,0.0,1.0,0.0,0.0,1.0,1.0,0.0,0,85.0,0.0,1,Utiliza las herramientas otorgadas en el curso que permiten reforzar conocimientos ,1.0,"['utilizar', 'herramienta', 'otorgado', 'curso', 'permitir', 'reforzar', 'conocimiento']"
569,1.0,1.0,1.0,1.0,1.0,1.0,1.0,1.0,1.0,0,84.0,0.0,2,ps el salon esta muy preparado puede ser poco accesible,1.0,"['ps', 'salon', 'preparado', 'poder', 'ser', 'accesible']"
570,0.0,0.0,0.0,1.0,0.0,0.0,0.0,0.0,1.0,0,88.916,0.0,2,Porque te ayuda en lo que necesitas Porque no queda muy claro el tema y las asesorías son muy tarde,0.0,"['ayuda', 'necesitar', 'no', 'quedar', 'claro', 'tema', 'asesoría', 'tarde']"
571,0.0,0.0,0.0,1.0,0.0,0.0,0.0,0.0,0.0,1,63.413,0.0,1,Es tolerante con los alumnos y flexible ,0.0,"['tolerante', 'alumno', 'flexible']"
572,0.0,1.0,1.0,1.0,1.0,1.0,0.0,0.0,0.0,0,81.0,0.0,1,Buena explicando pero exámenes un poco difíciles. ,1.0,"['buen', 'explicar', 'examen', 'difícil']"
573,1.0,1.0,1.0,1.0,1.0,1.0,1.0,1.0,1.0,0,74.103,0.0,1,Excelente maestra siempre esta para apoyarte ,1.0,"['excelente', 'maestro', 'siempre', 'apoyartar']"
574,1.0,1.0,1.0,1.0,1.0,1.0,1.0,1.0,1.0,0,84.777,0.0,1,Explica de forma que comprendes fácilmente y a buena velocidad ,1.0,"['explicar', 'forma', 'comprender', 'fácilmente', 'buen', 'velocidad']"
575,1.0,1.0,1.0,1.0,0.0,0.0,0.0,1.0,0.0,0,85.583,0.0,1,Por que domina bien los temas ,0.0,"['dominar', 'bien', 'tema']"
576,0.0,1.0,1.0,1.0,0.0,1.0,0.0,1.0,0.0,0,73.187,0.0,2,es buena maestra solo que aveces no sabe como explicarlo de una manera mas fácil es buena maestra solo que aveces no sabe como explicarlo de una manera mas fácil,1.0,"['buen', 'maestro', 'solo', 'avez', 'no', 'saber', 'explicar', 'él', 'manera', 'mas', 'fácil', 'buen', 'maestro', 'solo', 'avez', 'no', 'saber', 'explicar', 'él', 'manera', 'mas', 'fácil']"
577,1.0,1.0,1.0,1.0,1.0,0.0,1.0,1.0,1.0,0,81.5,0.0,1,"Buena maestra, le gustan las mates y es muy buena explicando ",1.0,"['buen', 'maestro', 'gustar', 'mate', 'buen', 'explicar']"
578,1.0,1.0,0.0,1.0,0.0,0.0,1.0,1.0,1.0,0,90.416,0.0,2,porque sabe mucho y explica los temas de la manera mas sencilla no tengo motivos para no recomendarla,0.0,"['saber', 'explicar', 'tema', 'manera', 'mas', 'sencillo', 'no', 'motivo', 'no', 'recomendar', 'él']"
579,1.0,1.0,1.0,1.0,1.0,1.0,1.0,1.0,1.0,0,83.181,0.0,2,explica muy bien no tengo disconformidades,1.0,"['explicar', 'bien', 'no', 'disconformidad']"
580,0.0,1.0,0.0,0.0,1.0,0.0,0.0,1.0,1.0,0,84.25,0.0,2,"Es buena maestra y da asesorías. Explica sus clases muy rápido, a veces aunque no entiendas el tema la clase sigue.",1.0,"['buen', 'maestro', 'dar', 'asesoría', 'explicar', 'clase', 'rápido', 'vez', 'aunque', 'no', 'entender', 'tema', 'clase', 'seguir']"
581,1.0,1.0,1.0,1.0,1.0,1.0,1.0,1.0,1.0,1,78.958,1.0,1,Apoya con asesorias en video y da completo apoyo para el aprendizaje individual ,1.0,"['apoyar', 'asesoria', 'video', 'dar', 'completo', 'apoyo', 'aprendizaje', 'individual']"
582,1.0,1.0,0.0,1.0,1.0,1.0,1.0,1.0,1.0,0,90.24,1.0,1,Es muy bueno y tiene mucho tacto. ,1.0,"['buen', 'tacto']"
